<?xml version="1.0" encoding="UTF-8" ?>
<!DOCTYPE shop SYSTEM "C:\Users\Vakhidat_Matiyeva@epam.com\IdeaProjects\parser\src\main\webapp\xml\internet-shop.dtd">
<shop xmlns:xsi="http://www.w3.org/2001/XMLSchema-instance"
      xsi:noNamespaceSchemaLocation="internet-shop.xsd">
    <category name="Mobile devices">
        <subcategory name="Smartphone">
            <product id="b215f9e4-804b-408b-a0b6-5de01b80b4eb">
                <product-name>Asus Zenfone 2 Laser</product-name>
                <producer>ASUS</producer>
                <model>Sd123</model>
                <date-of-issue>11-11-2015</date-of-issue>
                <color>red</color>
                <price>56.66</price>
            </product>
            <product id="d12e63ff-b14a-4fb9-811f-3de4f4c48576">
                <product-name>Asus Zenfone 2 Laser</product-name>
                <producer>Asus</producer>
                <model>aa123</model>
                <date-of-issue>12-11-2015</date-of-issue>
                <color>black</color>
                <not_in_stock>true</not_in_stock>
            </product>
            <product id="b1fbc22e-5833-4cd6-a4fe-f127265f31ad">
                <product-name>Asus Zenfone 2 Laser</product-name>
                <producer>Asus</producer>
                <model>DC678</model>
                <date-of-issue>17-11-2015</date-of-issue>
                <color>blue</color>
                <price>56.88</price>
            </product>
        </subcategory>
        <subcategory name="Tablets">
            <product id="c56c28a2-c122-4337-b24f-4cd60cb932be">
                <product-name>Ipad air</product-name>
                <producer>Apple</producer>
                <model>ss234</model>
                <date-of-issue>01-11-2015</date-of-issue>
                <color>black</color>
                <price>500</price>
            </product>
            <product id="ad57cf47-8882-496c-a298-8004f2a255c7">
                <product-name>Ipad 4</product-name>
                <producer>Apple</producer>
                <model>dd124</model>
                <date-of-issue>03-11-2015</date-of-issue>
                <color>white</color>
                <price>300</price>
            </product>
            <product id="b0eec2cd-fee2-4b5a-afe6-53f219bba14e">
                <product-name>ThinkPad Tablet</product-name>
                <producer>Lenovo</producer>
                <model>gg644</model>
                <date-of-issue>23-11-2015</date-of-issue>
                <color>black</color>
                <not_in_stock>true</not_in_stock>
            </product>
        </subcategory>
    </category>
</shop>